timestamp,speaker,words,tags
,AUDIENCE MEMBER,Yeah.,AUDIENCE
,DR. STIBITZ,"That's a good one. I'll have to think about that. We are almost exclusively concerned with human studies, so it's not clear -- I mean, clearly, that would not require human study. Exactly what part of FDA would deal with that, it's not clear to me. But you're aware, of course, that CFSAN, the Center for Food Safety and AppliedNutrition, has approved phage for use on meats and fish to decontaminate, but that's a little bit different.",STIBITZ
,DR. CARLSON,"All right. So that's all the time we have for this session. We're going to take a quick break. I'm going to say we'll come back at 3 because we're running a little behind. If you have questions for Scott, you can obviously come ask him now, but we'll get back to all these topics during the discussion panel later.",CARLSON
,,"(Whereupon, a short recess was taken.)",
,DR. CARLSON,"Everybody, we're going to try and get started again, if you can take your seats.",CARLSON
,,(Pause.),
,DR. CARLSON,"Okay. We're going to continue with the FDA presenters. Next up is Doran Fink, also from CBER, a clinical reviewer, is going to talk about regulatory considerations for clinical evaluation of phage products.",CARLSON
,DR. FINK,All right. Who's ready for some more regulatory talks?,FINK
,,(Chorus of no's and applause.),
,DR. FINK,Yeah. Is everyone recaffeinated? Good to go? Okay.,FINK
,,"So the usual FDA disclaimer. My commentsare an informal communication and represent my own best judgment, not Scott's judgment, that was his talk. This is my own best judgment, and, of course, what I say does not bind or obligate the FDA.",
,,"And, actually, as I've been listening to the talks throughout the day today, I've realized that pretty much everything I'm going to talk about has already been covered, so I might as well just skip to the summary slides. No.",
,,(Laughter.),
,DR. FINK,I'll throw in a few bits of wisdom or maybe not so much wisdom from the clinical regulatory perspective. So I'm going to start out just with a few introductory slides about key variables and overlying regulatory principles for phage therapy. The bulk of the talk will be about considerations for clinical development under IND and licensure of phage therapy products. I'll talk a little bit about personalized phage therapy in this section as well. And then I'll end with some discussion and some additional information about compassionate use of phage therapy products under our expanded access IND mechanism.,FINK
,,"So these are not an exhaustive list of variables that are relevant to phage therapy productsthat have been discussed, some in great detail during previous talks, so you can think about phage therapy in terms of spectrum of activity, whether you're talking about defined products, either a single phage or a cocktail active against one or more bacterial strains or species versus a personalized phage therapy product that is selected for activity against a single clinical isolate.",
,,"You can think about route of administration, whether it's topical, interlesional, inhaled, intravenous, oral, or others, and then, if you throw in that the product is administered with a device or as part of a matrix, that adds a layer of complexity.",
,,"You can also think about whether the phage therapy product is intended for use as a stand-alone product, which we really haven't talked about at all, or whether it's to be used as an adjunct to antibiotics or as salvage therapy.",
,,"No matter which of these variables you need to consider, there are a number of regulatory principles that will apply to all phage therapy products. First and foremost, that phage therapy products are by definition, and Scott showed you the regulatory definition in his talk, phage therapy products are biological drugs. They are biologics andthey're drugs. And so, consequently, any clinical use of an unlicensed phage therapy product in the U.S. must be conducted under Investigational New Drug or IND regulations. So, for all intents and purposes at the current time, this applies to all phage therapy products. We don't have any that are licensed for use in the U.S.",
,,"And in order to get a phage therapy product licensed for use in the U.S., we will require a demonstration of safety, purity, potency, which is interpreted to mean effectiveness, and consistency of manufacture. And I have safety and potency underlined because those are the attributes that are the chief concerns of clinical development.",
,,"So Scott had a slide that was very much like this one in his talk. I'm not going to dwell on it too much, only to show you that, as Scott said, while effectiveness in manufacturing consistency are attributes that are demonstrated in greater detail and with greater certainty, as the various stages of clinical development progress, safety considerations predominate throughout the development process, beginning with pre-clinical development and extending all the way through licensure and beyond.",
,,"So what are the safety considerations thatare relevant for phage therapy products? Well, we've heard a lot today that phage are directly active only against specific target bacteria and are presumed for all intents and purposes to be inert with respect to human cells and tissues, and certainly we have a lot of accumulated clinical experience, mostly anecdotal, that would appear to corroborate this presumption. However, for any new investigational product, I think it's still important to consider a couple of safety items.",
,,"Number one, whether certain human tissues might be sensitive to components of phage material. So, as an example, you might imagine a patient who has a fulminant lower respiratory tract infection with compromised airway function and whether introduction of a large amount of phage antigen might somehow inflame that tissue and at least initially exacerbate the patient's condition. This is a theoretical concern. It's not something that's been described, but something to think about.",
,,"Similarly, one might worry about the potential toxic effects of product excipients or impurities. We've had some discussion today about residual endotoxin in phage preparations. One might also worry about the potential toxic effects of adevice or a matrix that's used to administer the phage therapy product.",
,,"And then, in addition to these potentially direct effect-related safety concerns, you might also want to consider indirect effects, such as effects of bacterial lysis at the site of infection, whether the phage might be able to transfer antibiotic resistance genes, and, finally, whether the phage might result in some changes to the microbiome. This would obviously be a greater concern for a cocktail that has a much wider spectrum of activity than it would for a single phage therapy product, but again just something to consider.",
,,"So, when one is thinking about initiating clinical development of a phage therapy product under IND, the antibiotic development model will naturally come to mind, and in that model, first-in-human Phase I studies of investigational drugs are typically conducted in healthy volunteers and they focus on safety and, if applicable, which is usually the case for antibiotics, pharmacokinetics.",
,,"However, for a phage therapy product, it's unclear how relevant safety and PK data generated in healthy volunteers would be to patients with active infections where the phage may interact with andmultiply in target bacteria. So, as alternatives, one might consider taking into account, of course, the potential risks and any pre-clinical data that are available, conducting first-in-human studies not in healthy subjects but in relatively healthy subjects who are colonized by target bacteria but who do not have active infections or, to take it even a step further, first-in-human studies in less severely ill patients with active infections caused by the target bacteria.",
,,"Once you've selected your patient population, then the question is, well, what is your starting dose? What is your regimen? How do you select these?",
,,"Well, one approach would be to rely on data from relevant animal models. If there is prior clinical experience with related phage therapy products, that experience might be informative. Alternatively, do you just go with the maximum achievable titer in preparation? These are all possibilities.",
,,"Then, once you've started your trial, how do you optimize the dose and regimen for later development? What data can you collect from this first-in-human study and later studies to arrive at adose and regimen that will be the most safe and most effective?",
,,"So here are some relevant questions. How informative are pharmacokinetic data for making dose and regimen adjustments? Is clearance from the bloodstream after IV infusion relevant? We've heard an argument that maybe it's not. Is pharmacokinetic data from the site of infection informative? Maybe, maybe not. And how informative are measures of phage activity that are not directly related to morbidity and mortality? For example, does quantitative culture of the target bacteria from the site of infection help you in any way in determining dose and regimen?",
,,"Ultimately, the specific data to support initiation of clinical development and the design of early phase studies for phage therapy products will be reviewed by us in the context of IND submissions, and as Scott mentioned, we encourage prospective developers of phage therapy products to request a pre-IND meeting with us to discuss these topics. I have a URL up here on official FDA guidance for requesting formal regulatory meetings.",
,,"So let's think a little bit more toward late-stage development and licensure, and the regulatory principles that will be important here arethat labeling requirements are that all indications for a licensed product must be supported by substantial evidence of effectiveness. This substantial evidence must come from demonstration of effectiveness based on adequate and well-controlled clinical studies using a product that is standardized as to identity, strength, quality, purity, and dosage form.",
,,"So, as you can imagine, this is going to be challenging enough for defined phage cocktails. It's going to be ever-more challenging for personalized phage therapy. We do have initiatives for development and licensure of personalized medicine products, and so, you know, you can rely on the FDA to exercise regulatory flexibility in its approach to these requirements, but regardless, the intended indication of the phage therapy product will guide the design of the clinical trials to demonstrate safety and effectiveness.",
,,"So there are, of course, a number of very important challenges for demonstrating effectiveness of phage therapy products, in particular, those that are intended for use against multidrug-resistant bacterial organisms. Some of the challenges are outlined here.For example, it can be challenging to recruit adequate numbers of subjects with the relevant disease process and pathogen to the intended use, even in larger multi-center trials. It can be challenging to identify and enroll eligible subjects in a timely manner relative to the course of illness. One related challenge is that the bacteria present at the site of infection at the onset of illness may be very different phenotypically from the bacteria that are present after antibiotic treatment has been ongoing for some time and even after phage therapy has been initiated and ongoing for some time.",
,,"And, finally, there is obviously the potential for confounding by non-uniformity of concomitant treatments, such as antibiotics and other therapies, especially for critically ill subjects where you cannot ethically withhold standard of care.",
,,"Fortunately, there are potential avenues available to address many of these challenges. One such avenue is the possibility of streamlined and/or adaptive trial designs. Joe Toerner will talk next after me and will discuss in some detail the CBER draft guidance on pathogen-focused antibacterial therapies, parts of which may be relevant to development of phage therapy products.Supportive efficacy data from relevant animal models may also be important for supporting licensure. And, finally, there's the availability of alternative licensure pathways, for example, accelerated approval in which approval can be based on a surrogate end point that is reasonably likely to predict clinical benefit, with the caveat, of course, that there's a post-licensure requirement to confirm this benefit.",
,,"I've heard a lot from people during the breaks about these and other challenges. Oh, my.",
,,(Laughter.),
,DR. FINK,"Okay. I'll soldier on. So, you know, one suggestion might be that developers who are just starting out on clinical trials for -- is my mike off now? My mike is off.",FINK
,,"Okay. So developers who are just starting off on development of phage therapy products might first want to try to minimize the variables that are inherent to the intended use. So, you know, maybe start with disease processes and patient populations where you can minimize those variables. Maybe start with Staph infections, Staph wound infections, generate data that might be more broadly generalizable to other disease processes and build from there.So let's spend a few slides talking about personalized phage therapy, and by personalized phage therapy, in case anyone has not yet been hit over the head with it today, is the situation in which one or more phage selected from a library after screening for activity against specific clinical isolates from a specific patient. And then, on top of that, additional phage may be selected during the treatment course if evidence of decreasing effectiveness due to the development of bacterial resistance or immune clearance is found.",
,,"So the principal challenge is that the phage library may include a very large number of uncharacterized phage, so how then to provide this as a licensed product while ensuring safety and effectiveness.",
,,"Well, it turns out that we've encountered this type of situation in a regulatory manner in the past related to licensure of minimally manipulated allergenic placental or umbilical cord blood for use in specified hematopoietic disorders, and this situation is described in great detail in the FDA guidance cited below.",
,,"Just to boil it down to its pure essence, for these cellular products, each lot of the productis different, but the safety and effectiveness of each lot is ensured by, first of all, an established manufacturing process and, second of all, by specified product characteristics that are used as release criteria for the lot.",
,,"Now there's a huge caveat for using this as precedent for phage therapy, and the caveat is that the guidance above was based on a very large docket of data, accumulated over many years, together with advisory committee input on several occasions. So we're talking about a potentially long road ahead to arrive at a similar point for phage therapy products for personalized use.",
,,So it's unclear at this time whether a similar approach would be feasible for personalized phage therapy products. Might be. Might not be. There may be other approaches that are feasible as well. But whether it will be feasible will really depend on this central question: Can safety and effectiveness of an entire phage library be inferred based on specified product characteristics and accumulated experience with a limited subset of phage from that library?,
,,"And to break that question down into a couple of different components, first of all, for agiven indication or disease process and usage or route of administration and dosing regimen, is it reasonable to extrapolate safety and effectiveness across different phages? I don't know. Someone out there please tell me.",
,,"For a given phage therapy product, is it reasonable to extrapolate effectiveness across different indications or usages? I think that's a higher bar to clear and typically is not the accepted paradigm for licensure of antibiotics.",
,,"And so the question that I would ask the field to weigh in on is what variables or product characteristics might be used to predict and prospectively address uncertainties with safety and/or effectiveness, and then how do you apply those predictions to ensuring safety and effectiveness of personalized phage therapy products?",
,,"So what does the road ahead look like? Well, right now, after many years of largely anecdotal experience, at least in the modern era, we currently have no licensed phage therapy products available in the U.S., and so while Jason correctly pointed out that at least in the very near term use of phage therapy is likely to be under expanded access, our challenge to you, to the phage therapy field, is toinitiate scientifically rigorous clinical development programs that include adequate and well-controlled clinical trials to support licensure of phage therapy products, and to continue the positive messaging that Scott started before the break, CBER is prepared to assist developers of phage therapy products in addressing this challenge.",
,,"Now that doesn't mean that we're going to have ready answers to all of your questions, including many of the big ones, but we will certainly evaluate your proposals and we will help you think about reasonable, feasible, and scientifically sound approaches to address these questions and to develop your products.",
,,"So, in the meantime, I'll end the talk with a little bit more information about compassionate use or use under expanded access IND. The regulations for this are outlined in 21 C.F.R. 312, subpart (i), and compassionate use is to facilitate the availability of investigational drugs for patients with serious or immediately life-threatening diseases or conditions. All compassionate use under expanded access is subject to the following requirements.",
,,"So, first of all, there is no available comparable or satisfactory alternative. Theenrollment of the patient in a clinical trial, presumably under IND, is not possible. The treating physician should judge that the potential benefit justifies the potential risks and that those potential risks are not unreasonable in the context of the patient's disease or condition. And, finally, providing the investigational drug will not interfere with the clinical development of the product for the expanded access use.",
,,"So I cannot overstate that the primary purpose of expanded access use is to provide access to investigational drugs for patients in need. We are happy to do so. However, expanded access use is not intended to facilitate systematic collection of safety or effectiveness data to support licensure, and therefore, expanded access use is not a substitute for adequate and well-controlled clinical trials.",
,,"There are several different categories of expanded access, each with its own criteria for initiating use. In general, the level of evidence required increases as the number of individuals to be treated increases. We've heard the most today about individual patient expanded access, which includes emergency use, and for this use, the probable risk from the drug should not be greater than the probablerisk from the disease, as I said a couple slides ago. The next step up would be an intermediate size population expanded access IND. Here, there needs to be evidence that the drug is safe at the dose and duration proposed for use to justify a clinical trial of approximately the same size as the number of patients intended to be treated. There should also be preliminary evidence of effectiveness.",
,,I'd really like to steer the field away from intermediate-size expanded access use. I think whenever possible the use should be in the context of controlled clinical trials because that's where the most useful data is going to be generated.,
,,"The last category of expanded access which I'll just mention very briefly is treatment protocol or widespread use. Here, this use generally requires clinical data from Phase II or III trials, and usually there needs to be active pursuit of marketing approval for the investigational drug.",
,,"So here are the procedures for requesting expanded access use of a phage therapy product or any investigational drug for that matter. The request can be made as a new IND submission or as a new protocol in the context of an existing IND. The request needs to include applicable administrative CMC, pharm/tox,and clinical information, as outlined in the regulations.",
,,"The information that we would require for single patient emergency use is going to be much more limited than for more widespread expanded access use. Ideally, this information would include a clinical history and treatment plan and CMC information about the phage source and preparation, endotoxin content, and sterility, and activity against a clinical isolate.",
,,"As you saw from the examples this morning, these are not absolute requirements, and, you know, obviously, it would depend on the clinical status of the patient and the degree of the need. All expanded access use requires documentation of informed consent and IRB approval or, for emergency use, IRB notification after the fact.",
,,"CBER can authorize emergency use expanded access for single patients based on informal communication, for example, by telephone communication, oftentimes within hours. The authorization is given for a single treatment course. So what does that mean, single treatment course?",
,,"Well, ideally, this would be defined with respect to the duration and the number of doses, butwe recognize that for phage therapy this is not going to be possible a lot of the time, and there may even be some change to the product administered, as you saw in Chip Schooley's example as emergence of resistance develops over time.",
,,"So we'll work with you, you know. Come with a proposal, we'll work with you. If emergency expanded access use is authorized, a formal submission is required within 15 days after this authorization.",
,,"I have below some contact information for physicians who are considering emergency use expanded access of phage therapy for single patients. There are phone numbers for contacting our office during business hours as well as, after hours, the emergency line, or you can, if you prefer to contact us by email, there's a general address, and then Cara Fiore, who was mentioned in several of the morning talks, has graciously agreed to have her email address made public. She's really the focal point of phage therapy regulation in our office.",
,,"Okay. So I'll end with a couple of summary points. Clinical evaluation and use of unlicensed phage therapy products in the U.S. must be conducted under IND. Development and licensure of phage therapy products will depend on product characteristics andintended use. CBER is, of course, prepared to assist the phage therapy field in addressing scientific and regulatory challenges. And, finally, the expanded access IND mechanism is available for compassionate use of phage therapy products but is not a substitute for adequate and well-controlled clinical trials.",
,,"So I'd like to thank everyone at CBER who helped with preparation of this talk, and if we have time for any questions, I'm happy to take them.",
,,(Applause.),
,DR. CARLSON,So we have just a little bit of time. We can take maybe two questions.,CARLSON
,AUDIENCE MEMBER,"Yeah, thank you for that talk. I'm just kind of curious. I work at CDC and there's a real interest there, of course, in antimicrobial resistance and particularly in, you know, the use of fecal microbial transplants and probiotics in potentially treating -- you know, preventing antimicrobial resistance in the gut, in the gut flora or microbiome.",AUDIENCE
,,I'm kind of just curious. Do you see any sort of corollaries between your view of how you're going to deal with these issues with using probiotics and regulating those and phage?,
,DR. FINK,"Right. Well, I guess the biggestparallel is that, you know, while probiotics may be defined organisms, once you get into the realm of microbiota-based products, you're dealing with a, you know, largely uncharacterized product, and so that may vary from, you know, from batch to batch and lot to lot. And so there you're kind of running into the same questions about, you know, how do you ensure that a given lot of product is going to be safe and effective, you know, based on whatever data you've accumulated with that product to date.",FINK
,,"So there are parallels and, of course, we have been working to address those very questions with microbiome-based products as well.",
,MR. OUSTEROUT,"Hi. Dave Ousterout from Locus Biosciences. Just curious what your thoughts are on making smaller data sets in terms of Phase II and, you know, the extreme is Animal Rule and how that might be more applicable in phage therapy, particularly for MDR.",OUSTEROUT
,DR. FINK,"Right. So, you know, we do recognize that, you know, powering trials for, you know, MDRO-related indications is going to be difficult. There are, you know, various ways that clinical trials can be structured that might be able to take advantage of smaller sample sizes while stillproviding substantial evidence of effectiveness. Joe might touch on that a little bit in his talk as well.",FINK
,,"The issue of Animal Rule is an entirely different issue, you know, altogether.",
,DR. CARLSON,Okay.,CARLSON
,AUDIENCE MEMBER,"Hi, I'm just wondering about the safety of phage therapy. As you mentioned, you know, we have a lot of confidence on the safety of phages and your concern you highlighted will be the impurity and also endotoxin level.",AUDIENCE
,,"So, if we follow the instruction and do the testing, eventual testing, do we still need to do the standard package for toxicity?",
