timestamp,speaker,words,tags
,DR. GABARD,"We didn't do that in the study for Phagoburn. For Phagoburn, we tried to make a wide spectrum cocktail based on selecting phages against a wide collection of bacteria from the same species.",GABARD
,AUDIENCE MEMBER,Could I ask about that? Did you do retrospective when the Phago -- if something didn't go right? Did they check to see whether the cocktail worked against the isolatedbacteria?,AUDIENCE
,DR. GABARD,"I think for phage therapy, it's important to remember you have a low number of recruitment of patients. If your number is already low and you don't check at the beginning of the strain the sensitivity to the treatment, then you end up with potentially reducing the number of efficient patients.",GABARD
,AUDIENCE MEMBER,But did you check?,AUDIENCE
,DR. GABARD,"No, we didn't.",GABARD
,AUDIENCE MEMBER,I mean afterwards.,AUDIENCE
,DR. GABARD,"Afterward, of course, we did.",GABARD
,AUDIENCE MEMBER,And so you could correlate failures with absence of --,AUDIENCE
,DR. GABARD,This is going to come in the paper.,GABARD
,AUDIENCE MEMBER,"Yes, nice try.",AUDIENCE
,DR. GABARD,Good try.,GABARD
,AUDIENCE MEMBER,Yeah.,AUDIENCE
,,(Laughter.),
,DR. KINCAID,Please.,KINCAID
,AUDIENCE MEMBER,"So I'm going to be a little bit of a heretic, I guess. I've seen a lot of examples of compassionate use for phage. Makes sense. I've heard about the banks being formed. The question I want to ask and it may be both transnational. Isthis going to be more than an academic national effort to develop phage therapy? In other words, what are the economic incentives for industrial development? Part of the issue with antibiotics has been, of course, in the early days, a lot of big companies were involved in antibiotic development, but as that become less lucrative they all dropped out. Many of them have dropped out. Any new antibiotics are basically reserved for, you know, third-line use when it's absolutely necessary to use it.",AUDIENCE
,,"So what's the economic incentives for developing phage therapy at an industrial scale for, you know, the vast population as opposed to compassionate use?",
,DR. KUTTER,"I can answer. One piece of that, when we first got involved in this back in 1997, two people came from Tbilisi and brought their phages, and we got a bunch of bacteria from cystic fibrosis patients from Children's Hospital in Seattle, and theirs had been used in wound care, and what we found was that all but one of those was very effectively hit by the group of phages in both Pyophage and Intestiphage, and the one that wasn't hit later on when we did the genomic analysis of the 16S RNA turned out not to be aeruginosa even though it had beendiagnosed as such. That's not true with all kinds of bacteria. There certainly are some, but that's something that companies need to think about as they're developing it.",KUTTER
,,"Similarly, against E. coli, a bunch of similar ones have been isolated against O157 from countries in every part of the world, from Iran to Korea to Australia to Evergreen, and some of those between Evergreen and Belgium were very similar. So it seems like most of the phages wind up going to a lot of different countries.",
,DR. SCHOOLEY,"I was just going to say I think, you know, we have to be a little careful about trying to get so general that you can't get to specifics about could it ever be used. I think there are some clinical indications that you could think about that might be first pegs in the board.",SCHOOLEY
,,"For example, if you find that you can more reliably sterilize prosthetic joint infections by adding a phage to an antibiotic directed at an organism that doesn't require 16 phages to cover it, like Staph, you may be able to find a product there that has a much more traditional paradigm, development paradigm.",
,,"As you begin to do that, then you can startfilling the blanks around that as people develop a bit more comfort with the general therapeutic approach and as more of the molecular data that Ry is talking about evolves and you can start thinking about how to extrapolate from that situation.",
,,"So I think it would be a big mistake to shoot our feet off before we start trying to walk by saying it'll never be scalable and why would pharma ever do this. So I think it's great to raise it, but I hope nobody outside the room heard it.",
,,(Laughter.),
,DR. KINCAID,"I'm going to take a small prerogative and just put a footnote on our first phage workshop that was held two years ago. We did receive interest from major providers of solution sets for surgical intervention. So it's one of those cases, as Chip just pointed out, where there are people always who are looking for an opportunity if they feel that it's going to make their products better or improve or, in a contrary sense, to reduce the liabilities associated with their products. They'll probably in a very measured way take whatever measures are necessary to consider phage as potential, you know, adjunctive elements to their products.",KINCAID
,,So I think I agree with Chip that we have towait and see how these things play out as more and more people become familiar with the nature of the potential for the product.,
,MS. EMRICK,"Good morning, afternoon. I am Robin Emrick, and just a member of the interested public. And listening to you guys this morning got me thinking about something and, actually, Dr. Schooley, you sort of hinted at it. I hear about the problems of the specificity and nailing it down, and I thought I wonder if somebody isn't already looking at and solved the idea of having a less acute circumstance where like, okay, you're going to have this kind of surgery in three weeks and we're going to start you on some kind of a, I'll say generalized phage therapy that's going to knock down the prevalence of resistance plasmids that may or may not be present in your system. Just kind of prime your body to already be a little more responsive to the antibiotics they already have.",EMRICK
,DR. KINCAID,"So that turns out to be a rephrasing of one of the topics that we had talked about discussing here. We've had such a good response I didn't want to break that flow, but in a more general sense, it would be useful for the panel to weigh in on the sort of scope of phage use that couldbe considered in a preemptive way as a prophylaxis. Is this something that one might consider, whether it be surgical intervention or decolonization of at-risk patient populations? I mean, quite apart from the business model. What's the feeling from surgeons and others?",KINCAID
,DR. NARAYAN,"So that's a thought that I brought up with Randy earlier on. The problem, though, is that if, as we pointed out earlier, you start administering these phages way ahead of surgery, then you can potentially build up other resistant organisms, as we've seen with antibiotics. It seems to make complete sense to sort of rid your body of all antibiotics before you proceed to interventional procedures which implant large volume of foreign substances, but it's never been shown to be effective since antibiotics are useful if you give them immediately before surgery and doses during surgery.",NARAYAN
,,"And so the question is could we do that with phages as well, as opposed to doing it a priori and then building up resistant organisms?",
,DR. SCHOOLEY,"I'd like to invite Dr. Narayan to join our Department of Surgery because our surgeons often are not that concrete in their thinking because they put antibiotic beads in everything, andthe data supporting that is relatively modest. If you think about it, there are situations, though, where phage are not going to be -- as far as we can tell aren't a big problem. If you have a prosthesis you're putting in, you do get periodically Staph epi infections, for example, of hips. But the difficulty in clinical development is if you have a good surgeon and you have good antibiotic and you have good antiseptic conditions, the instance of that is low enough that showing that by sprinkling some phage in that you've decreased the instance of that complication is complicated, is very difficult.",SCHOOLEY
,,"And so I think the clinical development paradigm is complicated even though theoretically it makes a lot of sense as long as you do it at the time and don't get way ahead of yourself and allow for second and third generation organisms to populate, which is what Darwin's all about.",
,DR. KUTTER,"I think one other thing that we've been thinking about, and we've done some work and published one paper on working with treating diabetic toe ulcers with phage, and we started by using just pure Staph phage. We did that even though we knew there probably are other bacteria besides the ones that are coming out and what they're saying, butthe podiatrists see Staph as the head of the snake in these kinds of particularly very poorly aerated toe situations and so forth, and what we found is even though we had Pyophage available with others if we needed it, the staph alone has been enough to treat all 11 patients we've tried before whose only other possibility was amputation, which normally then within five years even if it's just a toe to start with leads to death.",KUTTER
,,"And so I'd really like to see some of those kinds of situations. I mean, I've seen Staph and diabetic foot being a logical target since I saw my first experiment in 1996. It wasn't an experiment, it was a treatment by the leading surgeon in Tbilisi, and what amazed me was not only that it worked to treat a foot that had come in for amputation, but he was 95 percent sure it would work.",
,,"In other words, you're talking there with a situation where it may be that Staph is indeed the head of the snake and simply making a bed that allows other bacteria to grow as well, but the wound's all healed. That's the final thing that we've used so far even though half of them have very obvious osteomyelitis. There's clearly bone infection and the Staph is getting into the bone.And I would really like to see, and I think several groups, both AmpliPhi and Pherecydes are talking about really going to that model, and what we're just starting to do now is to do metagenomics and look at the wounds before and after and see in that case what bacteria are really present and to what degree our model is true.",
,,"I think we need to choose some of those simple situations and make it possible without it costing a million dollars right away for trials to be run that are simply adding something to a standard treatment that's happening and not being an expensive clinical trial or even very expensive processes. He's just been doing it in his office, and it's simply something that we add without any extra expense. And I think we need a lot more of that kind of data and not just the data that's come from things that are what will be necessary for the companies wanting to make a lot of bucks about it.",
,,"I'd like to see a simple Staph phage thing be in effect like the -- like it's used with vaccines or even with aspirin where it's -- you know, what we use is about $5 worth of phage from Tbilisi to treat, and I'd like there to be situations where we can get a lot of this kind of data that's done very generallyand for relatively little money and be able to really build up an understanding better of what's going on.",
,DR. NARAYAN,"I'm going to circle back to the commercial question as well as reply to the previous question. So a good scenario, for instance, is ventral hernias are a very common surgical problem. You have a big operation. A significant number, especially in this day and age with obesity being so high, develop ventral hernias. And so you treat ventral hernias by putting in prosthetic mesh, and then we see this sort of cycle of when it gets infected you have this core population that cannot get rid of an infection.",NARAYAN
,,"So, to Randy's point, that might be a situation where you can actually apply certain phages specific to the bug that you've sort of identified. In fact, there are matrices available now, rifampin-coated prosthetic meshes which sort of address the issue of MRSA, for instance, and that might actually be a commercially viable proposition given the increasing number of surgeries that you see, as well as addressing the issue of, you know, prophylactically giving phage even though in clean cases the incidence of infection is really low, say, maybe on the order of 1 to 2 percent. These cases represent a fairly largenumber that can actually be both commercially viable as well as treatable by phages specific to the particular bacteria.",
,DR. FINK,"One last point, and I see we have another question. So, just to get back to the issue of preventative use of phages or use for decolonization, there's no a priori reason why from a regulatory standpoint a phage therapy product couldn't be developed for preventative use, and, in fact, it's serendipitous that the regulatory review of bacteriophage products is housed in the Office of Vaccines at CBER, so we have a lot of experience regulating preventative products, and, of course, the devil is always in the details of clinical trial design and selection of end points.",FINK
,DR. KINCAID,"Okay. We have time for one question according to my timer. So, Carl.",KINCAID
,DR. MERRIL,"I'd like the panel, if they could, to amplify a little bit more about the economics. I want to just make a comment. I'm carrying this because, in 2003, I was invited to give the Harold Neu Infectious Disease Conference lecture on phage. This was when I had just done a study that we published in PNAS showing that phage could be highly efficacious and we could even make specialphage that were long-circulating, and so they invited me to give this lecture.",MERRIL
,,"But, in fact, the people from the companies, this was Glaxo and some other companies, said exactly what the previous questioner had brought up, that there just wasn't money in infectious diseases and they were cutting back on their antibiotic production.",
,,"But the reason I'm bringing it up as a question now is that there are factors that are affecting the economics, and I wonder if you could comment on them. For instance, the fact that hospitals are now responsible for hospital-acquired infections, number one; and number two, the time spent in an ICU can be far greater than anything anybody spends on any of these therapies we're talking about.",
,,I'm sure with Dr. Patterson his ICU time was immense.,
,DR. SCHOOLEY,He was lucky he was sick during a period when there was no cap on lifetime costs from insurance companies.,SCHOOLEY
,,"There are all kinds of costs that can be calculated into how this all comes back to us as a society. The problem is that they're all in different buckets, and that is where, you know, we have to try to figure out how to rationalize it so that we as a society can realize that the investment's worth it,but the individual funders themselves don't see it in it for them.",
,,"Companies want something that you give people for life, so they don't like antibiotics that work. They like antiretrovirals because you have to give them for life, but they don't like anti-HCV drugs, for example. Phage that work and sterilize, they're not going to like any more than they like these fourth generation antibiotics that they give to six people twice a year who have bacteria you can't treat with anybody else.",
,,"As an infectious disease physician, I'm always arguing with the hospital that the reason we're there is to reduce antibiotic use so you have fewer people in the ICU with multidrug-resistant antibiotics, and therefore I need to find a way to pay the faculty in my division, and the department in the hospital always says, well, just bill the patients. We're the ones who collect the money for the hospital. Don't you worry about that.",
,,"So you end up -- I think it's really a multiple bucket issue more than it is an issue of is it worth it as a society to do this. I think it is worth it as a society, but I think we need to be more creative in terms of how we cost account it. That'sthe extent of my physician/country doctor statement. DR. GABARD: I'm going to take on that physician/country doctor statement role for a second. So, if you look at it from a strictly commercial standpoint, all you have to do is look around. The Epi-Pen cost has gone up 400 percent. Martin Shkreli is on trial now for increasing costs for generics over 7,000 percent. So there may be something in the market forces itself drives the economics of potentially using this in a commercially viable fashion, and so that's never been addressed and I hope it never gets out of this room that, you know, phages can be sort of overpriced, if you will, to make economic sense for the companies.",
,DR. GÓRSKI,"One thing that surprises me always when we have this type of discussion is that, let's say someone gets cancer, you're going to increase his life by 12 months, and you're going to spend 20,000 bucks while doing that in treatment. So maybe he's going to lose his leg and you're going to spend 5,000 euros or dollars to preventative treatment, and this is too expensive? There is a problem.",GÓRSKI
,DR. KINCAID,"Well, I wanted to take this moment, first of all, it's an interesting note to endon, so philosophical but also so real, and this is a classical concern for infectious disease generally speaking, not just phage.",KINCAID
,,"But anyway, I want to take a moment to thank all of our speakers and our panelists for a very stimulating morning session, and I'm not exactly sure when we return. Do you have the number? One-oh-five according to Roger. Okay. Thank you very much.",
,,(Applause.),
,,"(Whereupon, at 12:15 p.m., the workshop in the above-entitled matter recessed, to reconvene at 1:05 p.m. this same day, Monday, July 10, 2017.)",
,,A F T E R N O O N S E S S I O N (1:10 p.m.),
,DR. CARLSON,"The rest of the people who are still at lunch will filter in briefly in the next few minutes. So we're going to get started back up with Session 2, and you can see on the agenda that we're really talking about regulatory considerations for phage products in this session. So we're going to start with some phage characterization and CMC and then get some talks from FDA folks who are actively involved in regulating these things.",CARLSON
,,"So, with that, I will start off by introducing Jason Gill from the Center for Phage Technology. He's going to talk to us about phage characterization.",
,DR. GILL,So good afternoon. I'd like to thank the organizers for inviting me here to give this talk.,GILL
,,"So I was asked to talk about phage characterization, which is a relatively large topic, so I'm obviously not going to be able to cover everything, all aspects of all things that you can characterize about phages. Some of the stuff I'm going to be talking about was touched on this morning when we were talking about the development of phagetherapeutic products. But really I want to kind of give an overview of where I think we are now and what I see as some obvious paths for the future, and I don't want -- we don't want to intend this to be like some kind of, you know, dictat that I'm giving to the audience about the things that everybody has to do, but these are things that we've been doing in our program and I think they've been helpful for us.",
,,"All right. So, when we talk about phage characterization, really, there's -- you know, we're doing this for a reason, right, so the reason is really you want to increase the efficacy, right, so you want to try to pick phages that hopefully have highest efficacy or at the very least get rid of phages that you think are not going to have any efficacy.",
,,"We want to increase safety, right. So we want to obviously eliminate phages that might have any deleterious features, at least ones that we can identify now with our understanding of phage biology, and also to increase efficiency, which is not something which is often talked about, but really this has to do with keeping yourself sane and trying to pick phages that actually are going to hopefully be better behaved in the lab and ones you can actuallydeal with, and to try to reduce your workload. So, whenever you want to try to characterize a phage, I think especially when we're talking about phage applications here for some kind of therapeutic, you really want to have a reason, right. So, for example, if you characterize a phage for thermal stability, you know, unless you're planning on putting the phage in a 70 degree environment, it doesn't really help you that much.",
,,"So, really, you should have an end point and you should have an actionable outcome for the characterization. Are you going to use this information to make a decision about using the phage or are you going to be able to rank the phages or are you going to be able to, you know, make some kind of rational combination of phages?",
,,"So host range obviously is probably the oldest character of a phage that people have looked at. It's still, I think, one of the most important characteristics. It really is kind of the minimum requirement for any kind of efficacy, right? I think the basic requirement for a phage you want to use for any kind of antibacterial is that it has to actually infect the strain that you're attempting to treat, right? That's kind of the basic.But the needs of host range will vary depending on the application you're looking for. So, for the more kind of company approach where you're trying to have like a mass produced and distributed product like, for example, Phagoburn, or the company approach, you know, you're really going to have a bias towards finding phages that have broader host range as much as possible. But if you're going for kind of the experimental, you know, personalized medicine eIND approach, having broad host range phages in a collection is convenient, but it's not necessarily required because if you have a phage that only infects that strain that you're trying to treat, but if it works well, that's really all you need.",
,,"But even then host range doesn't nearly give you all the information that you need, right. So you want to have all the phages that infect one target strain, and so this is going to work. Yes.",
,,"So, if you can imagine, here this is a KPC1. This is actually the NIH clinical center outbreak strain here. So we have a lot of phages that infect this strain. These are six phages that are isolated in our group over the last few years, and they all infect this strain. So, if this is the strain you want to treat, you have a lot of phage options. Andso these tells you these are phages you could use, but you may not necessarily want to use all six. That might be redundant. And you probably want to use more than one. And even if it does infect the strain, you don't have any guarantee it'll actually have any efficacy in vivo.",
,,"So another assay that you can -- factor that you can characterize is, you know, virulence, and so this is basically the ability of the phage to inhibit bacterial growth in liquid culture. This is probably one of the -- this is probably the second oldest character that's used for phage therapy. This is done in test tube, so we have very, of course, sophisticated ways of measuring it now. This is done in an automated plate reader where you can take a time point every 10 minutes. But really the result you're looking at is the integration of the absorption rate, latent period, and burst size of the phage altogether in this liquid culture.",
,,"So you can have this high throughput, but the principle is really the same as it was in the 1930s, but if you optimize the method a little bit, you can get some distinguishing between different phages. So here on the left these are all phages that infect -- these are KPC positive Klebsiellapneumoniae, a clinical strain. So, on the left, you have a high input MOI of phage to bacteria. All the phages look roughly the same, so you can see they're all what you would call virulent in liquid culture.",
,,"But if you, you know, tweak your inputs a little bit and you have less phage going in, you can see and you can start to separate these phages, and then this may give you some kind of indication of efficacy of these phages, and you can see this one phage down here, which is called 'Pharr,' suppresses growth better than the other phages, and so this might give you some indication that maybe this phage would be -- if you have to pick one of these phages that all infect the same strain, maybe Pharr would be one that you'd want to look at more closely as opposed to other phages.",
,,"So, when you're determining host range, I mean, the classic, the good-old spot assay, which I'm sure a lot of people here have done, it gives you a basic measure of phage sensitivity, but you can actually couple your virulence screening with your host strain, which is something we've started doing and Dr. Biswas has also started doing this as well in his nice -- the Omnilog System where you can kind of just do the virulence assays in a high throughput way and you can get anidea of the host strains and the virulence of the phage in one go.",
,,"So here are two different Salmonella strains with the same phage. You can see this strain here, 3003 is insensitive to this phage, right. You don't see any difference in growth when you add the phage, whereas here you can see an inflection of growth and so this tells you that this strain is sensitive to the phage, and also, if you have a number of phages that are sensitive, that give you some growth inflection, you get some idea about how sensitive they are or how active they are against that strain.",
