timestamp,speaker,words,tags
,DR. KINCAID,"Good morning, everyone, and thank you for coming. As the agency host for this meeting, I want to welcome you all. Dr. Peter Marks, the Center Director of Biologics at the FDA, will be giving some more in-depth opening remarks, but I just as a representative of NIAID, one of the co-sponsors, I just wanted to welcome you all and thank you for attending.",KINCAID
,,"At NIAID in particular, our programmatic efforts are driven by a combination of recognition of unmet medical needs and scientific opportunity. I think we all can recognize that antimicrobial resistance is a present and growing unmet medical need that needs attention, and this meeting and you coming here today, you are bringing us scientific opportunities that we wish to capitalize on and programmatically develop projects to move forward, and so I'm very hopeful for this meeting to give us some ideas and concepts that we, in conjunction with our sister agency at the FDA, can move forward to better prepare the ground for regulatory science that will enable the development in this whole category of countermeasures.So I wish you a very productive and pleasant and entertaining and educational meeting, and I'll turn it over to Peter.",
,DR. MARKS,"Okay. So welcome, everyone. Thank you all for coming to this workshop on bacteriophage therapy that's covering both scientific and regulatory issues.",MARKS
,,"The workshop's co-sponsored by the Center for Biologics Evaluation and Research at the Food and Drug Administration, in collaboration with the National Institute of Allergy and Infectious Diseases at the National Institutes of Health, and before I go much further I'd like to take a moment to thank those at both institutions for all of their work and their efforts putting together what should be a very engaging and informative program over the next two days.",
,,"I also want to take the opportunity to thank all of those who will be presenting and serving on panel discussions for making the time to travel here and to do so, all of those who have braved Metro to make it here, thank you, even those coming from locally.",
,,"Antibiotic development got underway seriously in the 1940s and reached its heyday in the1950s and 1960s. Although initially it was the source of miraculous cures for a variety of infections that were previously difficult or impossible to treat, it was not long before the problem of resistance to antibiotics that had been developed occurred.",
,,"Over the past two decades, such antibiotic resistance has really escalated to crisis-level proportions, and we now have the development of Methicillin-resistant Staphylococcus aureus that's present in many communities at high levels, vancomycin-resistant enterococci, and a variety of gram-negative organisms, such as Klebsiella and Pseudomonas species, that are resistant to multiple different antibiotics. In fact, some are remarkably resistant.",
,,"Ironically, though it was discovered a bit over a century ago before the modern antibiotic era, bacteriophage may turn out to be important therapeutics in combatting antibiotic-resistant infections.",
,,"First discovered by the English microbiologist Twort in 1915 and then characterized further by the French-Canadian scientist Félix d'Herelle, it was not until decades later the details of the lytic mode of action of phage were understood.Such limitations in mechanistic understanding, combined with the ready availability of antibiotics following the Second World War, led to the development of phage therapy for the treatment of human infections in the United States and Western Europe to really slow down and to be shelved for a number of decades. The work on phage therapy continued in some Eastern European countries, including Poland and Russia.",
,,"Over the past decade, however, the investigation of potential phage therapy has seen a renaissance globally as certain infections have proven to be quite resistant to our existing complement of antibiotics and the discovery of novel antibiotics to combat such resistance have become increasingly challenging from a practical perspective.",
,,"On the other hand, phage therapy appears to be non-toxic in humans and in animals, and phage have the benefit that their bacterial specificity allows sparing of the remainder of the beneficial microbiota. In addition, there's the potential to either select or engineer phage to target bacteria that develop resistance to these agents.",
,,"Over the next two days there will be talks and discussions covering the scientific, manufacturing, clinical, and regulatory issuessurrounding the use of phage therapy. Though challenges clearly remain in the development of phage therapy for the prevention or treatment of infections in humans, their potential clinical utility seems quite promising in a time when other options seem much less so, and that's particularly in certain circumstances, and thus -- let's see -- the adage 'What's old is new again' seems quite appropriate when describing the situation with phage, or said more modernly, 'Old is the new new,' and we look forward to a very informative and productive workshop over the next days.",
,,"Thank you very much, and we really appreciate your coming today.",
,,(Applause.),
,DR. KINCAID,"Good morning, everyone. My name is Randall Kincaid, and I'll be serving as moderator in the first session today. Just so that you're aware of it, we have an additional room, a companion room which is connected by VTC, and it is possible that if questions arise from those in that room, we will be entertaining sort of alternate questions if that comes up.",KINCAID
,,"Before we begin, I was asked to make a couple brief statements. First of all, that eachspeaker outside of the government was asked to submit documentation outlining their financial interests. This is an important matter, and these records are all in place. And secondly, that the proceedings of the workshop are being recorded for purposes of transcription and these will be made available at the end of our sessions. Well, it'll actually be made available after we've compiled them and all of that.",
,,"So, without further ado, I'd like to introduce our first speaker, Dr. Ry Young from the Center for Phage Technology at Texas A&M, who will provide us an overview of bacteriophage then and now.",
,DR. YOUNG,"So thanks for putting me in a position of leading off this, I think, historic conference. Since I work on phage lysis, I usually am the last talk in a phage conference, and that's because most people don't care about lysis and a lot of people have to leave early to catch flights. I couldn't figure out why I was chosen as the first one in this case. There's lots of other people who could have been more appropriate choices for the first speaker, but given the Metro problems and the security problems, I think Randy thought a lot of people might be late, and so it's better to have a buffer in the front.So we're going to -- this is going to be largely historical. I'm going to -- I'm not sure exactly why I chose to do it that way. I guess I saw the title 'Phage Then and Now,' and I felt pretty intimidated by that because I actually did not know much about how phage therapy had been conducted in the Phage Therapy 1.0 in the first part of the 20th Century, so I spent a lot of the last two weeks or more boning up on it, and I felt like I needed to pass what I learned or at least what I think I learned on.",YOUNG
,,"But then I also got this stern email from Randy saying I had to not only identify my conflicts of interest but also make it clear at the beginning of the talk. I think that makes sense. So I started thinking about my conflicts of interest, and I think really you're asking for bias, and I wanted to show this slide because I am a direct descendant of the Delbrück-Luria-Stent school. I was a Ph.D. student",
,,with -- where's the pointer? Is that the pointer right here?,
,,"Okay, I was Ph.D. student with this man, Hans Bremer, who was the first American post-doc brought to the United States by Gunther Stent, who was, of course, kind of the Luca Brasi if you view the phage group as a gang, Gunther was the Luca Brasi ofthat gang, and he went around recruiting talent in Germany and devastated Western Europe and brought them and seated them all over the United States, including in Texas, where I ended up after my Navy service. This is me in 1972 as a Ph.D. student. I had a little more hair. As you can see, the receding hairline was already going back, but I was imbued with the philosophy of the phage group. The place I did my training was a hotbed of phage biology; essentially, all 20 scientists worked on phages of different types.",
,,"And this is a quote from, a famous quote at the end of the introduction to a textbook that essentially everybody in my generation used as the textbook for phage genetics, and that was, 'The strange bacteriophage therapy chapter of the history of medicine may now be fairly considered as closed.' So, if there was ever a -- and this was in the 1960s, right. So, if there was ever an attempt to put something to sleep, this was it. Phage therapy sleeps with the fishes.",
,,"So, before I go on, I want you to notice, by the way, this was 1972 that this picture was taken. I want to acknowledge that there are -- I know two of these people, Betty Kutter and Carl Merril are here. I thought Shankar was going to be here. Is he not?Menaj is not here. Well, it's too bad. So I want to point out that all three of these people have a much deeper background in the applications of phage therapy. They were all committed to convincing the scientific public that there was a future in this 20 years before or 10 years at least before I even thought of it.",
,,"In fact, since I was up until quite recently biased by my training in the phage group, I was actually very anti-phage therapy, and if you want to notice here, these are publications in very respected journals published in 1968 and 1969 when I was still in the Navy. And, in fact, that's three years before I was back in graduate school, so these people have a much better background and perspective and should be giving this talk.",
,,"And, in fact, this is the way they all looked in 1972. The fact that they're so well-preserved.",
,,(Laughter.),
,,"Dr. YOUNG: All right. So the real conflict of interest in terms of, I guess, finances came when I was recruited to GangaGen. So, up to 2002, at the ASM convention where I was giving a lecture, I met Janakiraman or J. Ramachandran, who is the founder andCEO of the company GangaGen, a company at that time based in Bangalore, and those of you who know him, he has a charismatic personality and was very eloquent in convincing me that there was a future for phage therapy.",
,,"He first recruited me to the Scientific Advisory Board, and I've been active on that even to about 2009. I actually served as a research director for this company in my one year of biotech, and the most important thing to note is the company actually survived that spectacularly incompetent year of mine. And, in fact, they are still in business. They have products in clinical trials, and they have said hello to me, but they haven't asked me for any further input from me for about eight years, which shows that his acumen was even better.",
,,"But it did lead very importantly to me being able to convince the Texas A&M Board of Regents to establish a Center for Phage Technology, and I think we're the only state institution, more than $5 million was in setup money, and four faculty positions and an annual budget have been committed to the notion that phage biology can be put to important translational uses.",
,,"So, overall, I have three biases, threeconflicts. I have the original. By training, I was very anti-phage therapy. I still am a stockholder and member of the SAB of GangaGen, so there is a second bias. And then the third bias is I'm actually running a center that is meant to promulgate the use of phage translation. So that's the truth.",
,,"So the main sources for this talk are these here. I won't go through reading them. I'm primarily going to be focusing on the Eaton and Bayne-Jones Journal of American -- this is a review commissioned by the American Medical Association back in 1934, and it's the one that's regularly cited as being the death knell of phage therapy, of Phage Therapy 1.0, and some others. I'm going to leave these for people in the PDF file, those that can look these up.",
,,"I am not going to be talking about, I think, a much larger group of data about phage therapy in Eastern Europe and in Europe and in France. I've only recently become aware of how deep and scientifically complex all of that record is. It was explicitly ignored in the 1934 report, and since I'm trying to bring you up to speed on what happened to phage therapy in the United States, I really couldn't, and I don't have the expertise really, and Dr. Gôrski is going to be following up and I'm sure he'll be talkingabout that. This is the outline of the talk and I'm going to -- first, I'm going to do basically a review of phage therapy in the United States, I call it Phage Therapy 1.0, a brief word about the methods and formulations that were used. I'll spend the bulk of the talk reviewing the Eaton and Bayne-Jones report. These are the conclusions. They concluded the scientific basis of phage biology was in dispute, the commercialization was premature, and I think, I hope, I should be able to convince you that there was actual bias against both phage theory and d'Herelle in this report, and then I have a one slide 20/20 hindsight on what went wrong, and then a brief segment at the end about Phage Therapy 2.0 and how it's different and proposed standards.",
,,"This is the first paper. This is the beginning of it all. There's d'Herelle himself. This paper was read in September 1917. It was in the French National Academy of Sciences. I believe it's the first time where bacteriophage is actually written, and even here d'Herelle is already citing some of the properties of phages that we know are critical in our attempt to use them. That is, they're very often highly specific, and he also noted theycould be acclimatized. In a lot of ways, that means you could, by passaging them through target strains, you could adapt them to grow more efficiently on those strains.",
,,"I should point out that Gunther Stent even did -- so d'Herelle passed away in the mid-1940s, and phage therapy was really not active in the United States, at least in major publications, for the entire period of the '50s, '60s and '70s. Even then, Gunther Stent found it necessary in a review of a biography of d'Herelle to vilify him if you read these statements. This was written for a review in Science Magazine, and he couldn't say things like widely reviled, he had nothing to do with the conceptual ideological origins of molecular biology, which was ridiculous because he invented the plaque assay, without which we would know nothing about what goes on. He dearly enjoyed accepting undeserved credit. Well, we all do that.",
,,(Laughter.),
,DR. YOUNG,"So you can see that Luca Brasi still had his knives out for this guy. But at the time -- this was long after d'Herelle, d'Herelle didn't know that Gunther Stent was going to try to trash his science and his reputation. d'Herelle, he had contemporary enemies. It's always bad when youhave an enemy whose face is on a stamp. (Laughter.)",YOUNG
,DR. YOUNG,"And so it turns out Jules Bordet, who was high up in the Pasteur organization and a Nobel Prize winner, and I'm pretty sure that Bordetella is named for him. So he's a Nobel Prize winner who really despised d'Herelle and, in fact, was the major mover in pointing out that Twort had discovered phages two years earlier than d'Herelle. And John Northrop, who was a later Nobel Prize winner, was very much an opponent of the so-called d'Herelle-Twort Theory that phages were viruses, and then Albert Krueger, who was a prominent bacteriologist at Berkeley, was a protege of Northrop and basically his hit man, and wrote many, many anti-phage and anti-d'Herelle tracks. And it didn't help that both Northrop and Krueger were editors of major scientific journals at the time.",YOUNG
,,"So this is their theory. They had a completely -- a theory they view was an Occam's Razor Theory, that is, a much simpler idea, and that is that basically that what phage is was a self-replicating endolytic enzyme, so that there's an enzyme that would degrade a bacteria and then in the process of degrading that bacteria to create more enzymes fromdegrading the large molecules in the cell wall. So, effectively, it's analogous to the autocatalytic formation of trypsin from trypsinogen.",
,,"So, basically, their idea was lysozyme is a prion. This is the first prion theory from many, many years ago, and this was very -- because these people were so prominent and because their academic credentials and circles of contacts and editorships had a lot of sway, whereas d'Herelle didn't even have a college degree, it was difficult for d'Herelle to compete with this.",
,,"So d'Herelle went on to aggressively promulgate his ideas for using phage as a tool against bacterial infections. He was widely successful. In 1928, he sold his company that he'd set up to make phages for a million francs, and that was the same year that d'Herelle also took his job, full professorship at Yale, and apparently he did not tell his dean about this conflict of interest in terms",
,,"of -- so I actually think -- somebody may correct me here, but the company was run very badly for a while. Then he eventually took it over again. But in any case, the laboratory bacteriophage, which was the company that was making up to 10,000 doses per day in the late 1930s, including a phage Phi X174, whichturned out to be a really key experimental phage. So they sold what they called polyvalent phage capsules against dysentery, carbuncles, sinusitus, et cetera, and they supplied other companies, including Eli Lilly in the United States.",
,,"There were a lot of problems with these things, as you'll -- that basically we couldn't -- you expect for a premature commercialization. All of their so-called phages were simply filter sterilized lysates. There was no purification at all. There was no quality control, no standards. Assays were usually yes or no in terms of whether they worked or not.",
,,"The so-called polyvalent phage mixtures, which by their definition had multiple different phages, each targeted against a different bacterial potential pathogen. Sometimes these were grown together in mixed culture, and that led to simplification of the mixtures, and then the companies that distributed often put in disinfectants to preserve the phage lysates, but, of course, it does preserve them dead.",
,,"And this is a famous advertisement that I always showed in my phage class every year. This is the actual -- this is the advertisement for different polyvalent phage cocktails, including intesti-phageand pyo-phage, and I think these are at least ancestrally related to the -- Betty, isn't that right? They're ancestrally related to the ones --",
,DR. KUTTER,In the 1930s.,KUTTER
,DR. YOUNG,-- to Billeci. Yeah.,YOUNG
,DR. KUTTER,We still have some of the vials.,KUTTER
,DR. YOUNG,"Right. And the intesti-phage and pyo-phage mixtures have been developed and matured and also sequenced, I think, now, so we now know what was in them, at least in some of them.",YOUNG
,,Anyway. So this is a phage for whatever ails you. I notice here that this is 1936. It says it's under the control of Dr. d'Herelle. So this might be after he re-took control of the company.,
,,"But one thing I noticed in reviewing this literature was that there was a corruption of the word 'polyvalent.' So polyvalent was originally meant to mean multiple different phages, each targeted against a different strain, a different bacterial genus, so the pyo-phage would have phages against all possible or as many possible important bacterial enteric pathogens.",
,,"But polyvalent come to mean as in general usage as any phage preparation that would attackmultiple different 'races' or strains of the same species. So you have to be careful when you're reading the literature. They say polyvalent phage X, and you realize it's not really a polyvalent phage, it's a phage that plays against several host strains.",
,,"Okay. So there was, because of this lack of standardization and the other practices, for about a decade, there were many, many clinical studies done or treatments done and reported using these commercial preparations. There were at least four companies involved, and it led Margaret Straub and Martha Applebaum to publish in 1933 in Journal of American Medical Association their standardization. They went out and bought three samples. I think they had three of the four companies represented: Eli Lilly, Squibb, and Swan-Myers. Squibb called their preparation polyvalent phage for staph. Eli Lilly called it staphyl gel.",
,,"And they basically tested these off the shelf. They didn't ask the -- they bought them and tested their activity, and their findings were that the Lilly products contained an antiseptic that simply killed the phage and all the bacteria they mixed it with. The Squibb phage were highly variable. The one batch they bought had virtually no phage activity init. The next had high phage activity. And Swan-Myers had a potent staph phage in it, but it had, even though it was reputed to be effective against B. coli, it had no activity against any kind of colon bacteria.",
,,So this was kind of a warning shot that the stuff that was being used at least from commercial sources wasn't reliable. It is interesting that they showed their bias a little bit here because they wanted to say that the reason why they're doing this is is they wanted to protect the reputation of genuine bacteriophage. So I thought that was -- it made me feel good that they actually cared.,
,,"So I actually ran -- I encountered a 1930 sales manual for Eli Lilly which I thought was interesting. There are industry representatives here, and Lilly arguably is one of the most certainly prominent bio and pharmaceutical company. So this is a manual that each new salesman was given in I think it was a week-long training course. So it's organized by lessons, and the next to last lesson, Lesson 38, is bacteriophage because Eli Lilly was selling bacteriophage, and so I highlighted some of the things here.",
,,"They were very cagey about what they said these things were. They wanted their salespeople tobe able to talk to doctors and be able to answer questions, and they carefully note here that the Twort-d'Herelle hypothesis that these are basically viral living particles is not accepted yet by other investigators, and then very explicitly in italics, this is their italics, 'It is too soon to evaluate phagotherapy,' even though they're selling these lysates.",
,,"So these are the lysates that were sold and I believe at least two of these were directly from the bacteriophage company in Paris that d'Herelle had founded. So here it shows how they're prepared and, in fact, merthiolate is added to preserve, and I'm sure, although merthiolate's not hugely bad for phage, if you have it around for a month, I think it probably will kill it. It's very important to note that under what name are the bacteriophage filtrates licensed by NIH, and they're licensed as bacterial antigens, never as bacteriophages. So that was something that each salesperson had to say. These are not phages, these are antigenic lysates.",
,,"But they did come to the same conclusion that when you had failures with phage it was because there was a mismatch between the phage and the targeted bacteria. So they were of obviously a verymixed mind about the whole process. Okay. So this is the report. It was commissioned by the AMA, the so-called Council on Pharmacy and Chemistry. It was published over three issues of the Journal of American Medical Association with the explicit endorsement of the council, and I'm just going to highlight the things that are important.",
,,"They set out at the top to evaluate two things: the bacteriophage phenomenon, which I was a little surprised by, I didn't realize that they were going to evaluate the basic science; and then the therapeutic usefulness of bacteriophage.",
,,"And I did a little work looking into the background of the people who wrote this, and it turns out that Stanhope Bayne-Jones may have had a conflict of interest or at least a little bit of a question mark about him being assigned to do this. He had just taken the bacteriology position at Yale that had been vacated under very hostile circumstances by d'Herelle in 1933. The dean at Yale had basically invited d'Herelle to leave. He had first become afoul with him when he found out about his commercial connections, but also because he essentially never stayed there for more than a month at a time, and he also had a superb talent for pissing people off.So Stanhope Bayne-Jones was already -- at least you could argue that he might have been a little bit -- he may have tended more to find fault with d'Herelle than if he wanted to make his new dean happy.",
,,"He actually is a very stand-up guy, ended up a brigadier general. He was a multi-decorated war hero from World War I. He was the first person to study phage lysates with millisecond imaging, so he's a hero of mine, and he was actually a major mover in the 1964 Surgeon General's report that started the anti-smoking campaign. So, I mean, I don't want to cast any bad -- he certainly was a very consequential figure.",
