timestamp,speaker,words,tags
,,"The organism was sent to Texas A&M, and the phage search began. Unfortunately, at the same time the phage was being -- that Dr. Pirnay had was being shipped from Belgium to UCSD, preparations were being made and it was found that that particular phage did not have activity against our patient's organism.",
,,"In the library at Texas A&M, one of the phage from AmpliPhi was found to have activity. Dr. Young got in touch with AmpliPhi and they very quickly said, 'Of course, we'd be happy to let you use that phage.' And then he looked for environmental sources of additional phage that could be used in a cocktail against this patient's organism.",
,,"At that point, I called the FDA to get in touch with them to tell them that we would likely be asking for an eIND to give a home brew cocktail ofbacteriophage to a patient with a multidrug-resistant Acinetobacter. The FDA reviewer, who will be running a panel tomorrow afternoon, Cara Fiore, was very supportive, in fact, and said she wanted to organize a conference call with CBER to talk about some of the issues that they had been thinking about in terms of phage therapy. That was on March 1.",
,,"By March 4, she had made some internal discussions and said they really only need to know about if endotoxin assays had been done, what we knew about that, and what was being done about sterility. Otherwise, they were ready to go and they didn't want these stipulations to get in the way of starting phage therapy, and we provided that information a couple of days later and had approval from the FDA to proceed relatively quickly.",
,,"Meanwhile, back at UCSD, there was a lot of back and forth about what this was all about. Luckily, the patient's wife was one of the deans at UCSD and she got in touch with the chancellor, who was anxious to keep her happy, and he instructed the lawyers to make sure this worked. And so we had the university attorneys on our side very early on, which was very helpful, and actually a very positive interaction with the attorneys at Texas A&M.I then had to talk to the investigational drug pharmacy that would be administering the phage. They independently then contacted the Institutional Biosafety Committee, who told me that they would be meeting in three weeks to discuss the application to use -- to allow the phage into UCSD, and in the meantime, an MTA was being worked out between UCSD and Texas A&M.",
,,"And then, at that time, the FDA reviewer said that she also heard that there was some additional places that Acinetobacter-directed phage were being developed and suggested that if we wanted to, it might be useful to talk to the combined program that the Army and the Navy had been leading down the road, and she provided me with a couple of phone numbers and we decided to go ahead and do this. This was at a time when we're still full speed ahead down at Texas A&M, but we didn't yet have a phage cocktail that we could use.",
,,"So I got in touch with the two programs. The Navy was willing to have us ship the patient isolate to them, and we did. In the meantime -- this actually was actually sent by Ry's lab to the Navy, the first one, and they began to screen for phage as well.Fairly soon, this is -- you'll see more of this tomorrow, but this is just using the Navy's Biolog approach on the Texas A&M phage. You can see that compared to the control conditions, the phages individually or in a cocktail were able to suppress the Acinetobacter that the patient was growing. The Navy also were developing phage, as I'll show you in just a minute.",
,,The phage that -- the cocktail that was constructed were the AmpliPhi phage and three environmental phages that Ry's lab had come up with after they started the screening.,
,,"The plan was to go ahead and ship this cocktail to us and to do the endotoxin testing kind of as the phage were in transit. This is the Navy cocktail showing the four Navy phages and the cocktail together with the expression, 'This work being done by Biswajit Biswas,' who will be talking to you tomorrow about some of the issues related to preparation of the phages and selection for resistance.",
,,"We were back in touch with the FDA and one of the concerns we had was that each of the phages would have to be treated as an individual product, which would have required eight INDs. We were very pleased to hear that they were willing to consider thetherapeutic approach to this patient's organism as a single -- would be covered under a single IND and that we would only need to submit another one if we decided to switch and treat a different organism. Luckily, he didn't have a different organism that needed to be treated, so this entire process was carried out under a single eIND.",
,,Then we began to run into trouble with the endotoxin. About the time the phage cocktail arrived from Texas A&M the initial endotoxin assay showed quite a bit of endotoxin in the phage preps. We weren't sure whether this was an issue related to the endotoxin itself or whether there was an artifact in the assay. The assay repeated at San Diego State again showed quite a bit of endotoxin in the preps.,
,,"Forest Rohwer's lab at San Diego State then was engaged to try to scrub these preps and did that with an octanol extraction that, as I'll show you in a minute, was quite successful.",
,,"The first batch of Navy phages arrived shortly thereafter. They too had an unacceptably high level of endotoxin in them and, when measured at San Diego State, in fact, even a log higher than was seen in the assay done at the Navy.",
,,"The Texas A&M phage were scrubbed at SanDiego State with an octanol extraction and tangential centrifugation. The Navy then made a second batch of phage and scrubbed their phage using a cesium chloride gradient, which is their approach to phage purification. And at this point, we actually had phage that were really quite clean, giving you a",
,,"sense -- so this is the Navy cocktail, all of them together, showing you the endotoxin concentration per milliliter. These are the individual phage from Texas A&M. Again, much improved over the previous batches.",
,,"So, at this point, we had two sets of four-phage cocktails. The Navy cocktail is shown here. Each of these were environmentally obtained Myoviridae, as was suggested. These may well have been very similar. We really didn't have time to try to look for phage that were quite different in terms of their tropism and mechanisms of action. Same thing happened from Texas A&M for other Myoviridae. Again, environmental samples and shipped simultaneously.",
,,"The Texas A&M cocktail happened to arrive several days earlier than the Navy cocktail, and we decided that -- and then a second generation cocktail that Dr. Biswas will talk about tomorrow included a phage that was active against one of the organisms, the Acinetobacter that was selected for resistance toall eight of the initially employed phage. The phage arrive on March 15 and we have the data related to the endotoxin scrubbing, and this is the interventional radiologist, Andrew Picel, who was giving the phage into the three cavities that at this point were still being drained. The approach taken was to irrigate the cavities, then to introduce ten to the ninth plaque-forming units into each of the abscessed cavities, cross-clamped the cavity for about half an hour and then allowed the cavities to drain.",
,,"We saw a change in the characteristics of the drainage fluid, the pseudocyst, for example, before and after the phage were administered. Whether this is causal or not, we don't know, but certainly we did see a change in the characteristics of the drainage fluid.",
,,"About two days later the Navy phage cocktail were ready to go. The patient had in the meantime stabilized but hadn't gotten demonstrably better. We had been seeing over the previous four to five weeks kind of each day things were gradually worse. In the two days between the administration of the intracavitary phage and the time the Navy phage were ready, there were no changes in his clinical status. Whether or not it was causal or just happenstance,hard to know, but we still felt that we were not where we needed to be in terms of getting him better, and we knew that we had isolated Acinetobacter from his peritoneal cavity, which would be outside the field of the phage being introduced into the abscessed cavities. Every sputum that we obtained was full of Acinetobacter. Acinetobacter had been isolated from his urine and from time to time later on from his bloodstream. So we felt that if we were going to make any headway that we needed to switch to a parenteral administration approach and decided to give the Navy phage cocktail intravenously.",
,,"This is the ID fellow, Melanie McCauley, giving the first dose intravenously. He tolerated both phage administration routes quite well. He gradually saw fewer and fewer pressors over the course of the next 24 hours. Got gradually better, and then on Sunday evening actually woke up and recognized his daughter, who was sitting by the bedside.",
,,"At that point, we found that the Acinetobacter was now sensitive to minocycline. That was added to have maximal benefit from antibiotics as well. But Sunday morning things got worse again, and he again began to require pressors. His mental status declined and by 8 in the morning he was on threepressors and unarousable again. I was very concerned we'd done something with the phage. We stopped the phage therapy, cultured the bags to make sure that there were no bacterial contaminations, but also aware that he was someone who could certainly have intervening complications of being on the assay use, so we broadened his antibiotics and lo and behold found that he was now -- the next day he was growing anaerobic gram negative rods from his blood, probably again from his necrotic pancreatic bed, turned out to be a Bacteroides thetaiotaomicron.",
,,"He got better by Monday night, but again Tuesday morning he was in shock, requiring three pressors. This time he was noted to be in atrial fibrillation. The pulmonary attendings and fellows were sure it was the phage therapy again, and when we looked more carefully and it was found that he was in atrial fibrillation, I said did he -- I asked them whether he had become hypotensive before or after the atrial fibrillation. They said it was after. I said why don't you correct his rhythm and I bet you'll find that his blood pressure improves, and it turned out he got much better and it was really because they had diuresed him and had potassium depleted him that hehad flipped into atrial fibrillation. The only reason I'm getting into this is that patients like this have multiple complications that always get blamed on the new therapeutic, and that's what was going on throughout this first week of therapy.",
,,"Here he was by that evening, the next evening awake and interacting again with his family. He began to grow Acinetobacter less frequently, but we didn't have really good quantitative cultures, over the course of the next several days developed phage-resistant Acinetobacter that you'll hear about tomorrow from Dr. Biswas. We did some phage PK to give a sense of how this is just phage being given intravenously at time zero and then monitored in his bloodstream you can see cleared by 60 minutes.",
,,"His course after that was relatively chaotic. He was a sick guy. He had another bout of Acinetobacter sepsis associated with the drain that was in his biliary tree, migrating into his liver, but he gradually got better and was discharged in August.",
,,"Here he is leaving Las Vegas, and here he is in May just before returning to work with his wife, Steffanie Strathdee, both big fans of phage at this point in their homes. I'm sorry they can't be with ustoday. It would be much more fun to have had them present this case than me.",
,,"So lessons learned. It's feasible to develop a strain-specific bacteriophage cocktail if you have two academic groups turn over everything they're doing for several months for a single patient. The therapy was well tolerated and I'm convinced really turned his course around given where he'd been going over the course of that period of time, and that people like this seem to be very complicated to both treat and assess in the context of eIND therapy.",
,,"So, to finish, the strengths of eIND therapy, you benefit patients individually. Certainly, Dr. Patterson was benefitted by this therapy as far as I could tell as his physician. The eIND is very flexible. You can treat many different kinds of patients if they require therapy based on eIND considerations. And from the regulatory perspective, it's relatively straightforward.",
,,"The weaknesses are, however, that every patient's different and it's very had to aggregate patients and make sense of the data you collect prospectively. Every time you do this at a new place it's very complicated. The nurses were sure we were going to kill him with the phage. The pharmacy wassure that we were going to contaminate the pharmacy. The Institutional Biosafety Committee had my name on a list for a while, and I had been the previous chair of that committee. And the other issue is that none of the regimens are going to be standardized if you're treating one patient at a time.",
,,"You don't collect the data in a standard way. You don't have standardized end points, and it's not sustainable. You can't have academic laboratories doing this over and over again, and we had no resources to do this. We were shipping things back and forth using personal accounts. So there needs to be a more sustainable way to approach this.",
,,"So I'll stop there. We'll talk about more of this, I hope, on the panel and just say this was really a village that did this. Multiple people engaged in the laboratories that were making the phage. Scott Salka at AmpliPhi made the phage available. Quickly needed advice from Dr. Merril was extremely helpful in terms of the overall therapeutic approach. We were very fortunate to have the help of the FDA in approaching this. We had helpful lawyers, which is like an oxymoron sometimes, and very helpful people in our administration, which is also an oxymoron, and finally, a bunch of extremelyenthusiastic physicians that made all of the difference and allowed this to go forward. So thanks very much.",
,,(Applause.),
,DR. KINCAID,That's an impressive number of stars that were aligned at the right time for that gentleman. A very interesting story.,KINCAID
,,"I think what we'll do now is we'll go on to Dr. Narayan from Yale University, who will provide another example of treatment under eIND, which is obviously an important tool available under such desperate conditions.",
,,"Did you have something, Marcus, for me? Okay.",
,,"All right. At any rate, I'd like to introduce Dr. Deepak Narayan from Yale University, School of Medicine, and he'll give us an overview of another case, quite a different case involving a Pseudomonas infection. Deepak.",
,DR. NARAYAN,"Good morning, everyone. Before I get started, I'd like to thank a whole host of people who have enabled me to be here. Randy, Roger, and most importantly Peter Marks, whose connection with Yale enabled me to move things along, as you will see.So just a brief description of my talk. This is not going to be laden with scientific data, as Dr. Gôrski's was. It is a mixture of an apology for surgeons, some clinical storytelling, and some history which I think you'll find interesting.",NARAYAN
,,"So, as someone pointed out, paraphrasing Halliday, God must have really loved viruses because they are the most numerous replicating entities on this earth. The phage structure that we all learned in high school pretty much holds true now, and this is my first contact with phages when I learned about Twort and d'Herelle when I was in the 11th grade.",
,,"Coming from India as I do, I have personal experience with phage generation from the Ganges where you see sights like these where people drink directly out of the Ganges and never seem to suffer any ill effects, but it is when we drink water from New Haven, we seem to work up a huge host of gastroenteritis regardless of what else we do.",
,,"So the funny thing was that Hankin reported that a substance in the Ganges River prevented cholera and this was remarked upon by a fellow in New England named Mark Twain in his Tramps Abroad book. But the real hero of all this, as has been pointed out multiple times this morning, is d'Herelle, who wasalso the model for Arrowsmith by Sinclair Lewis, and interestingly was brought to New Haven by Dean Winternitz, which was pointed out by an earlier speaker, and owing to sharp practices that Gunther Stent wrote about in his review of Bill Summer's biography was asked to leave.",
,,"The most interesting coincidence, in fact, this whole episode has been a list of multiple coincidences, sort of like Swiss cheese holes lining up, but in a good sort of a way. His office was right next to mine when it was created about 100 years ago. He didn't really do too well at New Haven, probably drank the same tap water that I did, malaria -- phrenic nerve palsy and sort of moved on to France.",
,,"So the big issue is why am I as a plastic surgeon talking about all this stuff, and what might not be admittedly obvious is that we deal with a whole host of infectious problems, including necrotizing fasciitis, abscesses in the head and neck, infected craniotomy plates and so forth, as well as dealing with infected prostheses on a fairly regular basis. This is an example, and I apologize for the goriness of the pictures. You cannot have a surgeon talk without gory pictures.",
,,"For instance, this case of an infectedprosthesis which was referred from a local hospital. As you can see, a fairly large volume of foreign material, open wound ring, pus, and a standard treatment for this is to wash it out a few times, move what's called a muscle flap, in this case a gastrocnemius muscle, close it, and with a full expectation that it will heal, which it does most of the time.",
,,"We have other problems that we deal with, sort of more appropriate to the case that we're discussing. This is a veteran who presented with basically pus around the Dacron graft, an aortic valve replacement going all the way down, and this whole thing smelled like a sewer, and for a few days we were concerned that he had a colonic fistula.",
,,"Again, the treatment is to wash it out repeatedly, make sure you get good by-fill control, flip the pectoralis major muscle into the wound, close it using a wound vac, especially because it's infected, and then have him present with a well-healed wound approximately two months after the procedure.",
,,"And one final note. Another area where Dacron grafts are often used, vascular bypass grafts for lower extremity ischemia, and in this picture you see the graft right about there. That little line isto show the radiograph is where the graft actually is, and the groin is probably the most commonly contaminated site of vascular graft infections.",
,,"So the treatment, once again, as with the chest, is to wash it out, get as much control locally as you can, and flip a nearby muscle in order to deliver antibiotics appropriately, with the antibiotic regimen continuing for about six weeks after the procedure.",
,,"We discussed these traditional approaches approximately 10 years ago now, and the reason for doing that is, again, because of the aging population we're beginning to see a greater number of these patients presenting with graft infections, and for the most part, and I want to emphasize this, is that we don't really need to resort to out-of-the-box thinking, such as phage therapy, in terms of treatment.",
,,"In fact, over the years, over the last 15 years we've dealt with approximately 150 graft infections, only one has been lost because of an infection with Pseudomonas as a matter of fact of the anastomotic site.",
,,"As you all know, there's a dramatic decrease in antibiotic drug approvals, an increase inantibiotic resistance, and I will not belabor the issue, and despite encouraging slogans such as 'Bad bugs need new drugs,' really not much has been forthcoming.",
,,"Pseudomonas aeruginosa is of particular interest to surgeons because it's responsible for a significant number of nosocomial pneumonias, burn, wound infections, which is of particular relevance to plastic surgeons, as well as other immunocompromised populations, as you know. And this is a really clever bug which has evolved multiple mechanisms by which to thwart the efforts of surgeons and ID specialists and most importantly has been associated with the formation of biofilm, especially with prosthetic material.",
,,"Now there are a whole host of mechanisms by which Pseudomonas survives, which I will, again, not belabor this crowd with, and a partial list of the drugs effluxed by the -- multiple drug efflux mechanisms are listed here for you to see.",
,,"So the story again begins as another coincidence whereby I was contacted by Dr. Paul Turner and his post-doc, Benjamin Chan, to set up a treatment for diabetic wound infections, and part of this discussion centered around the isolation of a newphage, the OMK01, which has been written about, which is the outer membrane polar knockout one, and this was isolated funnily enough from Dodge Pond in Connecticut, a site of Navy testing and apparently so toxic that none of the residents eat the fish from this pond anymore, and this is from a direct quote from a patient.",
,,"So the phage therapy approach, as you all know, can mimic the use of antibiotics. You treat it with a phage. You kill as many as you can. Resistance to phage is developed, and essentially what ends up happening is that you basically cannot use the phage to treat them anymore.",
,,"So these resistance-targeting antibiotics, which are basically a combination of these two, might actually help to deal with this problem. So the amazing thing about this OMK01 was that it actually latched on to the drug efflux pumps. And so the thought was that maybe we can use evolution to help us, and I want to emphasize that all this was done in Paul Turner's and Ben Chan's lab, and they were kind enough to lend me these slides.",
,,"So the thought was that if the resistant organism was forced to make a choice between resistance to antibiotics and resistance to phage, itwould lose because it was so closely intertwined that it could only be resistant to one, and, in fact, an in vitro test did demonstrate that this actually happened.",
,,"So I'm just going to briefly talk to you about the patient in question. This was a 75-year-old male, had a coronary artery bypass graft, was done in a neighboring hospital, along with an aortic arch replacement, similar to the picture that I showed you in the infected thoracic cavity.",
,,"Following surgery, he developed empyema and became extremely sick, requiring four pressors, at which point he was transferred over to Yale-New Haven Hospital. My boss happened to be on call, and he was leaving town, and so being the most junior on the totem pole, I was given the enviable task of taking care of this gentleman who -- which is now a matter of public record -- who was a faculty member and thereby obviously raised the strain involved in treating him.",
,,"So the patient was placed on antibiotics appropriately since he grew Pseudomonas, as depicted in these green shadows that you see on the cartoon here. So, after -- and I'm going to try to see if this actually works -- washing him a few times, you end up with this sort of a scenario where you have apus pocket, and I'm sorry if you can't see this back here, sort of the heart of the matter, if you will, which was the cause of the problems, as we'll talk about it. You can actually see the greenish block.",
,,"And so, again, in keeping with the previous treatment, keep washing him out as many times as we could. In this case, we did it about three times, and then used a muscle flap to close it. So, as a part of increasing the immune delivery in this area, we harvested the omentum through a laparoscope, which is the yellow plat-like substance that you see here, and during the course of this harvest we found that the field was filling up with blood, and, to my absolute horror, found out that he had actually ruptured his ventricle on the table, which, of course, prompted a repair with the help of the cardiothoracic surgeons, which you see out here. We used a piece of lung to patch that defect, and fortunately for all of us he survived.",
,,"So, despite actually having been discharged from the hospital, he was admitted at least four times for episodes of sepsis requiring IV antibiotics. He was placed on ciprofloxacin as a suppressive measure. He did present with one episode of bleeding which I thought was from the outer -- it turned out it wasjust a rib poking through an intercostal artery, which we cleaned up.",
,,"He was then asked to follow up and multiple requests from his son, who had a Ph.D. from Yale in immunology, urged me to find other places to treat this gentleman. Again, as Dr. Schooley pointed out, cardiothoracic surgeons refused to operate on him, saying that he was doing well and should be left alone. We contacted surgeons in Tokyo, Zurich, as well as in Texas, asking if this aortic arch could be replaced, and all of them basically declined to operate.",
,,"His son, who was pushing for experimental treatment, you know, suggested new antibiotics, and during the course of this whole business, I met with Drs. Paul Turner and Chan, who, as I said, presented a project for treatment of chronic wounds, and a few days after the meeting I realized that this gentleman is a perfect treatment choice for phages.",
